Exod.0.0	¶ The second boke of Moses called in the Hebrue: Ueelleh Schemoth: And in the Latin, Exodus.
Exod.1.1	These are the names of the children of Israel, which came to Egypte wyth Iacob, euery man came wt hys housholde:
Exod.1.2	Ruben, Simeon, Leui, and Iuda,
Exod.1.3	Isachar zabulon, and Beniamin,
Exod.1.4	Dan Nephtali, Gad and Aser.
Exod.1.5	All the soules that came out of the loynes of Iacob were .lxx. But Ioseph was in Egypte allredie.
Exod.1.6	And Ioseph dyed and all hys brethren and all that generacyon,
Exod.1.7	and the chyldren of Israel grewe, encreased, multiplyed, and waxed exceadinge myghtye: and the lande was full of them.
Exod.1.8	But there rose vp a newe kynge in Egypte whych knewe not Ioseph.
Exod.1.9	And he sayde vnto his folke: beholde, the people of the chyldren of Israel are greater and myghtyer than we.
Exod.1.10	Come on, let vs playe wisely wyth them, lest they multiplye, Ꟶ lest it happen, that (yf there chaunce any warre) they ioyne them selues vnto oure enemyes and fyghte agaynst vs, and so gete them out of the lande.
Exod.1.11	Therfore dyd they sette taskmasters ouer them, to kepe them vnder wt burthens. And they bylte vnto Pharao treasure cities: Phiton and Rameses.
Exod.1.12	But the more they vexed them, the moare they multiplyed and grewe, so that they abhorred the chyldren of Israel.
Exod.1.13	And the Egyptians helde the chyldren of Israel in bondage without mercye.
Exod.1.14	Therfore was their lyfe bytter vnto them in that cruell bondage, in claye Ꟶ brycke, and all maner of worke in the feldes. For all their bondage which they serued them, was full of tyrannye.
Exod.1.15	And the kynge of Egypte sayde vnto the mydwiues of the Hebrues women, of which the ones name was Sephora and the other Phua:
Exod.1.16	when ye do the offyce of a mydwife to the women of the Ebrues and se in the byrth tyme that it is a boye, ye shall kyll it. But yf it be a daughter, it shall lyue.
Exod.1.17	Not withstondynge the mydwiues feared God and dyd not as the kynge of Egypte commaunded them: but saued the men chyldren.
Exod.1.18	And the kynge of Egypte called for the mydwiues and sayde vnto them: why haue ye delt on thys maner, and haue saued the menchyldren?
Exod.1.19	And the mydwiues answered Pharao, that the Hebrues wemen are not as the wemen of Egypte: for they are sturdie women, and are delyuered yer the midwyues come at them.
Exod.1.20	And God therfore delt well with the midwyues. And the people multiplyed and waxed very myghtye.
Exod.1.21	And it fortuned because the midwyues feared God, he made them houses.
Exod.1.22	And Pharao charged all hys people, sayinge: All the menchyldren that are borne, cast into the ryuer, and saue the maydechyldren alyue.
Exod.2.1	And ther went a man of the house of Leui. And toke a daughter of Leui.
Exod.2.2	And the wyfe conceaued and bare a sonne. And when she sawe that it was a proper chylde she hyd hym thre monethes.
Exod.2.3	And when she coulde no longer hyde hym, she toke a basket of bulrusshes and dawbed it with slyme and pytche, and layde the chylde therin, and put it in the flagges by the ryuers brynke.
Exod.2.4	And his sister stode a farre of, to wete what wold come of it.
Exod.2.5	And the daughter of Pharao came doune to washe herselfe in the ryuer, and hyr maydens walked alonge by the ryuers syde. And when the sawe the basket amonge the flagges, she sent hyr mayde to fetch it.
Exod.2.6	And when she had opened it, she sawe it was a chylde: and beholde, the babe wepte. And she had compassyon on it, and sayde: it is one of the Hebrues chyldren.
Exod.2.7	Then sayde hys syster vnto Pharaos daughter: shall I go and call vnto the a nurse of the Hebrues wemen, to nurse the, the chylde?
Exod.2.8	Pharaos daughter answered her: Goo. And the mayde ranne and called the chyldes mother.
Exod.2.9	To whom Pharaos daughter sayde: Take thys chylde a waye, and nurse it for me, I wyll rewarde the. And the woman toke the chylde, and nursed it vp.
Exod.2.10	The chylde grewe, Ꟶ she brought it vnto Pharaos daughter, Ꟶ it was made hyr sonne, Ꟶ she called the name of it Moses, because (sayde she) I toke him out of the water.
Exod.2.11	And it happened in those dayes, when Moses was waxed great, that he went out vnto his brethren and loked on their burdens, Ꟶ spied an Egyptian smytynge an Hebrue whych was one of hys brethren.
Exod.2.12	And he loked rounde aboute, and when he sawe no man by, he slewe the Egyptian, and hyd him in the sonde.
Exod.2.13	And whan he was gone out another daye: beholde two Hebrues stroue to gether. And he sayde vnto hym that dyd the wronge: wherfore smytest thou thy felowe?
Exod.2.14	He answered: who made the a man of auctoryte to iudge vs? Speakest thou to kyll me, as thou kylledst the Egyptian? And Moses feared Ꟶ sayde: of a suertie thys thynge is knowne:
Exod.2.15	And Pharao herde of it, and went aboute to slee Moses: And Moses flyenge from the face of Pharao, dwelt in the lande of Midian, and he sat doune by a welles syde.
Exod.2.16	The preast of Midian had .vij. daughters which came and drewe water, and fylled the troughes, for to water their fathers shepe.
Exod.2.17	And the shepardes came Ꟶ droue them awaye: but Moses stode vp and helped them, and watered their shepe:
Exod.2.18	And when they came to Raguel their father, he sayde: howe happeneth it that ye are come so soone to daye?
Exod.2.19	And they answered: a man of Egypte delyuered vs from the hande of the shepardes, and so drewe vs water, Ꟶ watered the shepe.
Exod.2.20	He sayde vnto hys daughters. And wher is he? why haue ye so lefte the man? Call hym that he maye eate bread.
Exod.2.21	And Moses was content to dwell with the man. And he gaue Moses zephora hys daughter,
Exod.2.22	which whan she bare a sonne. called him Gerson: for he sayde: I haue bene a straunger in a straunge lande.
Exod.2.23	And it chaunced in processe of tyme, that the kynge of Egypte dyed, and the chyldren of Israel syghed by the reason of bondage, and cryed.
Exod.2.24	And their complaynt came vp vnto God from the bondage: and God hearde their mone. And God remembred hys promyse with Abraham, Isaac and Iacob.
Exod.2.25	And God loked vpon the chyldren of Israel, and God had respecte vnto them.
Exod.3.1	Moses kepte the shepe of Iethro hys father in lawe, preest of Midian, and he droue the flocke to the backesyde of the desert, and came to the mountayne of God, Horeb.
Exod.3.2	And the angell of the Lorde appeared vnto him in a flame of fyre out of the myddes of a bush. And he loked, Ꟶ beholde, the bush burned wt fyre, and the bush was not consumed.
Exod.3.3	Therfore Moses sayde: I wyll goo nowe, and see thys greate syght, howe it cometh that the bushe burneth not.
Exod.3.4	And when the Lorde sawe that he came for to see, God called vnto him out of the myddes of the bushe, and sayde: Moses, Moses. He answered: here am I.
Exod.3.5	And he sayde: come not hyther, put thy shooes of thy fete: for the place where on thou stondest is holy grounde.
Exod.3.6	And he sayde I am the God of thy father, the God of Abraham, the God of Isahac Ꟶ the God of Iacob And Moses hyd his face, for he was afrayed to loke vpon God.
Exod.3.7	And the Lorde sayde: I haue surely sene the trouble of my people whych are in Egypte, and haue herde theyr crye from the face of their taskemasters. For I knowe their sorowes,
Exod.3.8	and am come downe to delyuer them out of the hande of the Egyptians, and to brynge them out of that lande vnto a good lande and a large: and vnto a lande that floweth wyth mylcke and hony: euen vnto the place of the Cananites and Hethites, and Amorites, and Pherezites, and Heuites, and of the Iebusites.
Exod.3.9	Nowe therfore, the complaynt of the chyldren of Israel is come vnto me, and I haue also sene the oppressyon wherwith the Egyptians oppresse them.
Exod.3.10	Come thou therfore, and I wyll sende the vnto Pharao, that thou mayest brynge my people the chyldren of Israel out of Egypte.
Exod.3.11	And Moses sayde vnto God: what am I to goo vnto Pharao, and to brynge the chyldren of Israel out of Egypte?
Exod.3.12	And he answered: I wyll be wyth the. And thys shalbe a token vnto the that I haue sent the: after that thou hast brought the people out of Egypte, ye shall serue God vpon thys mountayne.
Exod.3.13	And Moses sayde vnto God: beholde, when I come vnto the chyldren of Israel, I shall saye vnto them: the God of youre fathers hath sent me vnto you, and yf they saye vnto me, what is hys name, what answere shall I geue them?
Exod.3.14	And God answered Moses: I am that I am: and he sayde: thys shalt thou saye vnto the chyldren of Israel. I am hath sent me vnto you.
Exod.3.15	And God spake further vnto Moses: thus shalt thou saye vnto the chyldren of Israel the Lorde God of youre fathers, the God of Abraham the God of Isahac, and the God of Iacob hath sent me vnto you: thys is my name for euer, and thys is my memoryall into generacyon and generacyon.
Exod.3.16	Goo and gather the elders of Israel to gether, and thou shalt saye vnto them: the Lorde God of youre fathers, the God of Abraham, the God of Isahac, and the God of Iacob apeared vnto me, and sayde: In visitynge haue I visited you, and knowe that which is done to you in Egypte
Exod.3.17	And I haue sayde, I wyll brynge you out of the tribulacyon of Egypte vnto the lande of the Canauytes, and Hethites, and Amorytes, and Pherezytes, and Heuytes, and Iebusytes: euen vnto a lande that floweth wyth mylcke and hony.
Exod.3.18	And whan they heare thy voyce then goo, both thou and the elders of Israel shall go vnto the kynge of Egypte, and saye vnto him: The Lorde God of the Hebrues hath met wyth vs: and nowe wyll we go therfore .iij. dayes iourney into the wyldernesse, and do sacrifyce vnto the Lorde oure God.
Exod.3.19	And I am sure, that the kynge of Egypte wyll not let you goo, no not in a myghtye hande:
Exod.3.20	and I wyll stretche out myne hande and smyte Egypte wyth all my wonders which I will do in the myddes therof. And after that he wyll let you goo.
Exod.3.21	And I wyll gett thys people fauoure in that syghte of the Egyptians: so that when ye goo, ye shall not goo emptie:
Exod.3.22	but a wyfe shall borow of hir neyghbouresse Ꟶ of her that soieorneth in hir house, iewels of syluer and of Gold and rayment. And ye shall put them on youre sonnes and daughters, Ꟶ shall robbe the Egyptians.
Exod.4.1	Moses answered and sayde: Se, they wyll not beleue me nor herken vnto my voyce: but will saye the Lorde hath not apeared vnto the.
Exod.4.2	And the Lorde sayde vnto him: what is that whych is in thyne hande? he answered a rodd.
Exod.4.3	And he sayde: cast it on the grounde. And he cast it on the grounde, and it became a serpent. And Moses fled from the syght of it.
Exod.4.4	And the Lorde sayde vnto Moses: put forth thyne hande and take it by the tayle. And therfore he put forth hys hande Ꟶ caught it, and it became a rodd in his hande.
Exod.4.5	For thys thinge (sayeth he) shall they beleue the, that the Lorde God of their fathers, the God of Abraham, the God of Isahac Ꟶ the God of Iacob hath apeared vnto the.
Exod.4.6	And the Lorde sayde forthermore vnto hym: thrust thyne hande in to thy bosome. And he thrust hys hande in to hys bosome. And whan he toke it out agayne, beholde, his hande was leperous euen as snowe.
Exod.4.7	And he sayde: put thyne hande in to thy bosome agayne. And he put hys hande into his bosome agayne, and plucked it out of hys bosome, Ꟶ beholde, it was turned agayne as hys other flesshe.
Exod.4.8	Therfore yf they wyll not beleue the nether heare the voyce of the fyrst token, yet wyll they beleue for the voyce of the seconde token.
Exod.4.9	But and yf they wyll not beleue the two signes, nether herken vnto thy voyce, thou shalt take of the water of the ryuer, Ꟶ powrest vpon the drye lande. And the water which thou takest out of the ryuer, shall turne to bloude vpon the drye lande.
Exod.4.10	Moses sayde vnto the Lorde: oh my Lorde, I am not eloquent from yester daye Ꟶ yeryesterdaye, Ꟶ namely sence thou hast spoken vnto thy seruaunte: but I am slowe mouthed and slowe tonged.
Exod.4.11	And the Lorde sayde vnto hym: who hath made mans mouth, or who hath made the domme or the deaff, the seynge or the blynde? haue not I the Lorde?
Exod.4.12	Therfore I will be with thy mouth, Ꟶ teache the what thou shalt saye.
Exod.4.13	He sayde: oh my Lorde, sende I praye the by the hande of him whom thou wilt sende.
Exod.4.14	And the Lorde was angrye with Moses, Ꟶ sayde: do not I knowe Aaron thy brother the leuyte, that he can speake? For lo, he commeth furth to mete the, Ꟶ when he seyth the, he wylbe glad in his herte.
Exod.4.15	Therfore thou shalt speake vnto hym, and put these wordes in hys mouth, and I wylbe with thy mouth and wyth hys mouth, and wyll teache you what ye ought to do.
Exod.4.16	And he shalbe thy spokesman vnto the people: he also shall be thy mouth Ꟶ thou shalt be hys God:
Exod.4.17	and thou shalt take this rodd in thy hande, wherwith thou shalt do myracles.
Exod.4.18	Therfore Moses went and returned to Iethro hys father in lawe agayne, Ꟶ sayde vnto him: I wyll go nowe, and turne agayne vnto my brethren whych are in Egypte, and se whether they be yet alyue. And Iethro sayde to Moses, goo in peace.
Exod.4.19	And the Lorde sayde vnto Moses in Midian: goo, and returne agayne in to Egypte for they are dead which went aboute to kyll the.
Exod.4.20	And Moses toke hys wyfe, and his sonnes, Ꟶ put them on an asse, and went agayne to Egypte, Ꟶ Moses toke the rodd of God in his hande.
Exod.4.21	And the Lorde sayde vnto Moses: when thou art entred Ꟶ come into Egypte agayne, se that thou doo all the wondres before Pharao which I haue put in thy hande: but I wyll holde hys herte, and he shall not let the people goo.
Exod.4.22	And thou shalt saye vnto Pharao, thus sayeth the Lorde: Israel is myne eldest sonne,
Exod.4.23	and I haue sayde vnto the that thou shuldest let my sonne goo, that he maye serue me. And thou woldest not let hym goo: beholde, I wyll slee thyne eldest sonne.
Exod.4.24	And it chaunced by the waye in the ynne that the Lorde mett hym, and wolde haue kylled him.
Exod.4.25	And zephora toke a stone, Ꟶ cut awaye the foreskyne of hyr sone, Ꟶ fell at his fete, Ꟶ sayde: a bloudyhusbande art thou vnto me.
Exod.4.26	Then he lett him goo. And she sayde a bloudy husbande, because of the circumcysion.
Exod.4.27	Then sayde the Lorde vnto Aaron: go mete Moses in the wildernesse. And he went and met hym in the mount of God, and kyssed him.
Exod.4.28	And Moses tolde Aaron all the wordes of the Lorde which had sent him, and all the tokens which he had charged him withall.
Exod.4.29	So went Moses Ꟶ Aaron and gathered all the elders of the chyldren of Israel.
Exod.4.30	And Aaron tolde all the wordes whych the Lorde had spoken vnto Moses, and dyd the myracles in the syght of the people,
Exod.4.31	and the people beleued. And when they herde that the Lorde had visited the chyldren of Israel and had loked vpon their tribulacyon, they bowed their head, and worshypped.
Exod.5.1	Moses Ꟶ Aaron went in after warde, and tolde Pharao, thus sayeth the Lorde God of Israel: Let my people goo, that they maye kepe holye daye vnto me in the wildernesse.
Exod.5.2	And Pharao sayde: who is the Lorde, that I shulde heare hys voyce, Ꟶ let Israell goo?
Exod.5.3	I knowe not the Lorde, nether will I let Israel goo. And they sayde: the God of the Hebrews hath mett with vs: and therfore wyll we go .iij. dayes iourney into the deserte, and sacrifyce vnto the Lorde oure God: lest there happen vnto vs ether pestylence or swerde.
Exod.5.4	Then sayde the kynge of Egypte vnto them: wherfore do ye, Moses and Aaron let the people from their worke, get you vnto your laboure.
Exod.5.5	And Pharao sayde furthermore: beholde, there is moche people nowe in the lande, and ye make them leaue their worke.
Exod.5.6	And Pharao commaunded the same daye vnto the taskemasters which were amonge the people, and vnto the offycers, sayinge:
Exod.5.7	ye shall geue the people no more strawe, to make brycke wyth all, (as ye dyd in tyme passed.) let them goo and gather them strawe them selues
Exod.5.8	and the nombre of brycke whyche they were wont to make in tyme passed, laye vnto their charges also, and mynysh nothynge therof. For they be ydell and therfore crye sayinge: we wyll goo Ꟶ do sacrifyce vnto oure God.
Exod.5.9	They must haue more worke layed vpon them, that they maye laboure therin, Ꟶ not regarde vayne wordes.
Exod.5.10	Than went the taskemasters of the people and the offycers out: and tolde the people Thus sayeth Pharao: I wyll geue you no moare strawe,
Exod.5.11	goo youre selues and gather you strawe where ye can fynde it, yet shall none of youre laboure be minyshed.
Exod.5.12	And so were the people scatered abrode thorowe out all the lande of Egypte for to gather stubbyll in stead of strawe.
Exod.5.13	And the taskemasters hasted them forwarde sayinge: fulfyll youre worke daye by daye, euen as yf ye had strawe.
Exod.5.14	And the offycers of the chyldren of Israel whych Pharaos taskemasters had sett ouer them, were beaten. And they sayde vnto them: wherfore haue ye not fulfylled youre taske in makinge brycke, both yesterdaye and to daye, as well as in tymes past?
Exod.5.15	The offycers also of the chyldren of Israel came Ꟶ complayned vnto Pharao, sayinge: wherfore dealest thou thus wyth thy seruauntes?
Exod.5.16	there is no strawe geuen vnto thy seruauntes, and they saye vnto vs: make brycke. And thy seruauntes are beaten, and thy people is foule intreated.
Exod.5.17	He sayde: ydell ar ye, ydell, and therfore ye saye: We wyll goo and do sacrifyce vnto the Lorde.
Exod.5.18	Goo therfore nowe and worke, and ther shall no strawe be geuen you, and yet shall ye delyuer the hole tale of brycke.
Exod.5.19	And the offycers of the chyldren of Israel dyd wyth heuynes loke on them that sayde: ye shall minyshe nothynge of youre daylye makynge of brycke.
Exod.5.20	And they mett Moses and Aaron, which stode in there waye as they came out from Pharao,
Exod.5.21	Ꟶ sayde vnto them: The Lorde loke vnto you and iudge you, whych hath made the sauoure of vs stincke in the eyes of Pharao Ꟶ in the eyes of his seruauntes, and haue put a swerde in their hande to slee vs.
Exod.5.22	Moses returned vnto the Lorde Ꟶ sayde: Lorde wherfore hast thou dealte cruelly wt this people: and wherfore hast thou sent me?
Exod.5.23	For sence I came to Pharao to speake in thy name, he hath fared foule wyth thys folke, and yet thou hast not delyuered thy people at all.
Exod.6.1	Then the Lorde sayde vnto Moses: Nowe shalt thou see, what I wyll doo vnto Pharao, for in a myghtye hande shall he let them goo, and in a myghtye hande shall he dryue them out of hys lande.
Exod.6.2	And God spake vnto Moses, and sayde vnto him: I am the Lorde,
Exod.6.3	I appeared vnto Abraham Isahac and Iacob as an allmyghtye God: and in my name Iehouah was I not knowne vnto them.
Exod.6.4	Moreouer I made an appoyntment with them to geue them the lande of Canaan: the lande of their pilgremage where in thy were straungers.
Exod.6.5	And I haue also herde the gronynge of the chyldren of Israel, whom the Egyptians kepe in bondage, and haue remembred my couenaunt.
Exod.6.6	Wherfore saye vnto the chyldren of Israel: I am the Lorde, I wyll brynge you out from the burdens of the Egyptians, and wyll rydd you out of their bondage, Ꟶ wyll delyuer you in a stretched out arme and in great iudgementes.
Exod.6.7	And I wyll take you for my people, Ꟶ wyll be to you a God. And ye shall knowe, that I am the Lorde youre God which brynge you out from the burdens of the Egyptians.
Exod.6.8	And I wyll brynge you vnto the lande concernynge the whych I dyd lyft vp my hande to geue it vnto Abraham, Isahac and Iacob, and wyll geue it vnto you for a possessyon: euen I the Lorde.
Exod.6.9	And Moses tolde the chyldren of Israel euen so: But they harkened not vnto Moses, for anguyshe of sprete and for cruel bondage.
Exod.6.10	The Lorde spake vnto Moses sayinge:
Exod.6.11	Goo in, Ꟶ speake vnto Pharao kynge of Egypte, that he let the chyldren of Israel goo out of hys lande.
Exod.6.12	And Moses spake before the Lorde sayinge: beholde, the chyldren of Israel herken not vnto me, howe than shall Pharao heare me? which am of vncircumcised lyppes?
Exod.6.13	And the Lorde spake vnto Moses and vnto Aaron, and gaue them a charge vnto the chyldren of Israel and vnto Pharao kynge of Egypte: to brynge the chyldren of Israel out of the lande of Egypte.
Exod.6.14	These be the heedes of theyr fathers houses. The chyldren of Ruben the eldest sonne of Israel are these: Hanoh, and Pallu, Hezron, and Charmi, these be the housholdes of Ruben
Exod.6.15	The chyldren of Simeon: Gemuel, and Iamin, Ohad, and Iachim, zohar, and Saul the sonne of a Cananytesh wyfe: these are the kynreddes of Simeon.
Exod.6.16	These also are the names of the chyldren of Leui in their generacyons: Gerson, and kahath and Merari. Leui lyued an hundred Ꟶ .xxxvij. yere.
Exod.6.17	The sonnes of Gerson: Libni and Semei by their kynreddes.
Exod.6.18	The chyldren of kahath: Amram, and Iesear, Hebron and Usiel. And kahath lyued an hundred and .xxxiij. yere.
Exod.6.19	The chyldren of Merari: Mahely and Musi: these are the kynreddes of Leui by their generations.
Exod.6.20	Amram toke Iochebed hys nece to wyfe and she bare hym Aaron and Moses. And Amram lyued an hundred and .xxvij. yere.
Exod.6.21	The chyldren of Iezear, Korah, Nepheg and Sichri:
Exod.6.22	The chyldren of Usiel: Misael, Elzaphan and Sithri.
Exod.6.23	And Aaron toke Elizaba daughter of Aminadab and syster of Nahason, to wyfe: whych bare hym Nadab, and Abihu, Eleazar and Ithamar.
Exod.6.24	The chyldren of Korah: Assir, and Elkana and Abiassaph: these are the kynreddes of the korahites.
Exod.6.25	Eleazar Aarons sonne toke him one of the daughters of Putuel to wife, which bare him Pinehas: and these be the pryncipall fathers of the Leuites thorowe out their kynreddes.
Exod.6.26	This is that Aaron and Moses to whom the Lorde sayde: carye the chyldren of Israel out of the lande of Egypte, accordynge to theyr armyes.
Exod.6.27	These are that Moses and Aaron which spake to Pharao kynge of Egypte, that they myghte brynge the chyldren of Israel out of Egypte.
Exod.6.28	And in the daye when the Lorde spake vnto Moses in the lande of Egypte,
Exod.6.29	he spake vnto hym, sayinge: I am the Lorde. speake thou vnto Pharao the kinge of Egypte all that I saye vnto the.
Exod.6.30	And Moses sayde before the Lorde: Beholde, I am of vncircumcised lyppes, and howe shall Pharao geue me audience?
Exod.7.1	And the Lorde sayde vnto Moses: beholde, I haue made the Pharaos God, and Aaron thy brother shall be thy prophete.
Exod.7.2	Thou shalt speake all that I commaunded the, and Aaron thy brother shall speake vnto Pharao, that he sende the chyldren of Israel out of hys lande.
Exod.7.3	And I wyll harden Pharaos hert, and multiplie my myracles and my wondres in the lande of Egypte.
Exod.7.4	But Pharao shall not herken vnto you, that I maye sett myne hand vpon Egypte, and brynge out myne armyes, and my people the chyldren of Israel out of the lande of Egypte, in great iudgementes,
Exod.7.5	and the Egyptians shall knowe, that I am the Lorde: when I stretche forth my hande vpon Egypte, and brynge out the chyldren of Israel from amonge them.
Exod.7.6	Moses and Aaron dyd as the Lorde commaunded them, euen so dyd they.
Exod.7.7	Moses was .lxxx. yere olde, and Aaron .lxxxiij. when they spake vnto Pharao.
Exod.7.8	And the Lorde spake vnto Moses and Aaron sayinge:
Exod.7.9	yf Pharao speake vnto you sayinge: shewe a wondre, thou shalt saye vnto Aaron: take thy rodd and cast it before Pharao, that it maye be a serpent.
Exod.7.10	Than went Moses and Aaron in vnto Pharao, and dyd euen as the Lorde had commaunded. And Aaron cast forth his rodd before Pharao and before his seruauntes and it turned to a serpente.
Exod.7.11	Than Pharao called for the wyse men and enchaunters, Ꟶ those wyse men of Egypte dyd in like maner wt there sorcery.
Exod.7.12	For they cast downe euery man hys rodd, and they turned to serpentes: but Aarons rodde dyd eate vp theyr roddes:
Exod.7.13	and he hardened Pharaos herte: that he herkened not vnto them, euen as the Lorde had sayde.
Exod.7.14	The Lorde also sayde vnto Moses. Pharaos herte is hardened, he refuseth to let the people goo.
Exod.7.15	Get the vnto Pharao in the mornynge, lo, he wyll come vnto the water, and thou shalt stonde vpon the ryuers brynke agaynst he come, and the rodd whyche turned to a serpente, shalt thou take in thyne hande.
Exod.7.16	And thou shalt saye vnto hym: the Lorde God of the Hebrues hath sente me vnto the, sayinge let my people goo, that they maye serue me in the wildernes: And beholde, hyther to thou woldest not heare.
Exod.7.17	Thus sayth the Lorde: In thys thou shalt knowe that I am the Lorde. Beholde, I wyll smyte (with the staffe that is in myne hande) the water that is in the ryuer, and it shall turne to bloude.
Exod.7.18	And the fyshe that is in the ryuer shall dye, and the ryuer shall stynke: and it shall greue the Egyptians to dryncke of the water of the ryuer.
Exod.7.19	And the Lorde spake vnto Moses, saye vnto Aaron: take thy staffe, and stretche out thyne hande ouer the waters of Egypte, ouer their streames, ouer their ryuers and pondes and all pooles of water, whych they haue, that they maye be bloude, and that there maye be bloud thorowe out all the lande of Egypte: both in vessels of wodd and also of stone.
Exod.7.20	And Moses and Aaron dyd euen as the Lorde commaunded. And he lyfte vp the staffe and smote the waters that were in the ryuer in the syghte of Pharao and in the syghte of hys seruauntes, and all the water that was in the ryuer, turned into bloud.
Exod.7.21	And the fyshe that was in the ryuer dyed and the ryuer stanke: and the Egyptians coulde not dryncke of the waters of the ryuer. And there was bloude thorowe out all the lande of Egypte.
