Exod.0.0	¶ The second boke of Moses called in the Hebrue: Ueelleh Schemoth: And in the Latin, Exodus.
Exod.12.50	And all the chyldren of Israel dyd as the Lorde commaunded Moses and Aaron. Euen so dyd they.
Exod.12.51	And the self same daye dyd the Lorde bring the chyldren of Israel out of the lande of Egipt with their armyes.
Exod.13.1	And the Lorde spake vnto Moses, saying:
Exod.13.2	Sanctify vnto me all the first borne, that open all maner matrices amonge the children of Israel aswell of man as of beaste: for it is myne.
Exod.13.3	And Moses sayd vnto the people: thynke on this daye in which ye came out of Egipt, out of the house of bondage: for thorow a mightye hande the Lord brought you out from thence. There shall no leuended bread be eaten.
Exod.13.4	This daye come ye out in the moneth when corne beginneth to rype.
Exod.13.5	When the Lorde hath brought the into the lande of the Cananites, Hethites, Amorites, Heuites Ꟶ Iebusites: which he sware vnto thy fathers that he wold geue the a lande wherin mylcke Ꟶ hony floweth, thou shalt kepe this seruice in thys same moneth:
Exod.13.6	Seuen dayes thou shalte eate swete bread: and in the seuenth daye, it is the feaste of the Lord.
Exod.13.7	Swete bread shalbe eaten seuen daies: and ther shall no leuended bread be sene, nor yet leuen with the in all thy quarters.
Exod.13.8	And thou shalt shewe thy sonne in that daie sayinge: this is done, because of that which the Lord dyd vnto me, when I came out of Egipte.
Exod.13.9	And it shalbe a signe vnto the vpon thyne hande, and for a remembraunce betwene thyne eyes, that the Lordes lawe maye be in thy mouth. For in a stronge hand the Lorde brought the out of Egipt.
Exod.13.10	Kepe therfore this ordynaunce in his ceason from yeare to yeare.
Exod.13.11	And it will come to passe, that the Lord shall bring the into the lande of the Cananites, which he sware vnto the and to thy fathers: and shall geue it the.
Exod.13.12	And then thou shalt appointe vnto the Lorde all that openeth the matrice. And euery caste thing, the fyrst doth open the matrice of a beast which thou hast: yf they be males, they shall be the Lordes.
Exod.13.13	And euery fyrst gendred of an asse, thou shalt redeme with a lambe: yf thou redeme him not, thou shalt breake his neck. All the fyrst borne amonge thy chyldren also, shalt thou bye out.
Exod.13.14	And when thy sonne asketh the to morowe, sayinge what is this, thou shalt saye vnto him: With a mightye hande the Lorde brought vs out of Egipt, out of the house of bondage.
Exod.13.15	And when Pharao was looth to let vs go, the Lorde slewe all the first borne in the lande of Egipte: aswell the fyrste borne of man as of beaste. Therfore I sacrice vnto the Lorde all the males that open the matrice, and all the fyrst borne of my children I redeme.
Exod.13.16	This shalbe a token vpon thyne hande, and a remembraunce betwene thyne eyes, that the Lorde brought vs out of Egipte thorowe a mightye hande.
Exod.13.17	It came to passe, that whan Pharao had lett the people go, God caryed them not thorowe the waye and lande of the Philistines, which was the more nye waye. But God sayde: lest the people happly repent whan they se warre: Ꟶ so turne agayne to Egipte.
Exod.13.18	But God led the people about thorowe the waye of the wildernes of the redd see. And the children of Israel went vp harnessed out of the lande of Egipte.
Exod.13.19	And Moses toke the bones of Ioseph with him: for he made the children of Israel swere, saying God will surely viset you, and ye shall take my bones awaye hens with you.
Exod.13.20	And they toke their iorneye from Sucoth: and abode in Etham in the edge of the wildernes.
Exod.13.21	And the Lorde wente before them by daye in a pyller of a cloude to leade them the waye: and by nyght in a pyller of fyer to geue them lyght, that they might go both by daye and nyght.
Exod.13.22	The pyller of the cloude departed not by daye, nor the pyller of fyer by night out of the sight of the people.
Exod.14.1	And the Lorde spake vnto Moses, saying:
Exod.14.2	Speake to the children of Israel, that they turne and remayne before Pi Hiroth betwene Migdol and the see, oueragaynst Baalzephon: and before that shall they pitch by the see.
Exod.14.3	For Pharao wyll saye of the children of Israel: they are tangled in the lande, the wildernes hath shut them in.
Exod.14.4	And I will harden Pharaos hert, that he shall folowe after you: and I will get me honoure vpon Pharao and vpon all his hoost, the Egipcians also shall knowe that I am the Lorde. And they dyd euen so.
Exod.14.5	And it was tolde the king of Egipt that the people fled. And the hert of Pharao and of his seruauntes turned agaynst the people and they sayde: why haue we this done that we haue let Israel go out of our seruice?
Exod.14.6	and he made ready his charettes: and toke hys people with him
Exod.14.7	and toke syxe hundred chosen charettes and all the charettes of Egipt and captaynes vpon euery one of them.
Exod.14.8	And the Lord hardened the hert of Pharao kyng of Egipt, and he folowed after the chyldren of Israel. But the children of Israel wente out with an hye hande:
Exod.14.9	and the Egipcians folowed after them, and all the horses and charettes of Pharao and his horsemen and his hoost ouertoke them abyding by the see, besyde Pi Hiroth before Baal zephon.
Exod.14.10	And when Pharao drewe nie, the children of Israel lyft vp their eyes and beholde, the Egipcians folowed after them, and they were sore afrayde: and the children of Israel cryed out vnto the Lorde.
Exod.14.11	But they sayde vnto Moses: because there were no graues in Egipt, hast thou therfore brought vs awaye for to dye in the wyldernes? wherfore hast thou serued vs thus, for to carye vs out of Egipte?
Exod.14.12	Dyd not we tell the this in Egipt, saying: let vs be in rest, that we maye serue the Egipcians? For it had bene better for vs to haue serued the Egipcians then for to dye in the wildernesse.
Exod.14.13	And Moses sayde vnto the people: feare ye not, stande styll, Ꟶ beholde, howe the Lorde shall saue you this daie. For ye that haue sene the Egipcians this daye, shall se them nomore for euer.
Exod.14.14	The Lorde shall fyght for you, and ye shall holde your peace.
Exod.14.15	And the Lorde sayde vnto Moses: wherfore cryest thou vnto me? speake vnto the children of Israel that they go forwarde.
Exod.14.16	But lyfte thou vp thy rodd, and stretche oute thy hande ouer the see, and deuide it a sondre, and let the children of Israel go on drye grounde thorowe the middest of the see.
Exod.14.17	And behold, I will harden the hert of the Egipcians that they maye folowe them. And I wyll get me honoure vpon Pharao and vpon all his host, and vpon his charettes and vpon his horsmen.
Exod.14.18	And the Egipcians shall knowe that I am the Lorde when I haue gotten me honoure vpon Pharao, vpon his charettes and vpon his horsmen.
Exod.14.19	And the angell of God which went before the hoost of Israel remoued, and beganne to go behynde them. And the clowden piller that was before the face of them beganne to stonde behynde them,
Exod.14.20	and came betwene the hoost of the Egipcians and the hooste of Israel. It was also a darcke clowde, and gaue lyght by nyght: and all the nyght long the one came not at the other.
Exod.14.21	And Moses stretched forth hys hande ouer the see: and the Lord caryed awaye the see by a verye stronge easte wynde all that nyght, and made the see drye lande, and the waters were deuyded.
Exod.14.22	And the children of Israel went into the myddest of the see vpon the drye grounde. And the waters were a walle vnto them, on their ryght hande, and on their lefte hande.
Exod.14.23	And the Egipcians folowed and went in after them to the myddest of the see, euen all Pharaos horses, hys charettes and his horsemen.
Exod.14.24	And in the morning watch, the Lorde loked vnto the hoost of the Egipcians out of the fyery and clowdy pyller: and troubled the hoost of the Egipcians,
Exod.14.25	and toke of hys charet wheles Ꟶ caryed them awaye violently. So that the Egipcians sayde: Let vs fle from the face of Israel: for the Lorde fighteth for them agaynst the Egipcians.
Exod.14.26	And the Lorde sayd vnto Moses: stretch out thyne hande ouer the see, that the waters maye come agayne vpon the Egipcian, vpon his charettes and vpon his horsemen.
Exod.14.27	And Moses stretched forth hys hande ouer the see, and it came agayne to his course rarly in the mornynge, and the Egipcians fledd agaynst it. And the Lorde ouerthrew the Egipcians in the myddest of the see:
Exod.14.28	and the water returned and couered the charettes and the horsmen: and all the hoost of Pharao that came into the see after them, so that there remayned not one of them.
Exod.14.29	But the chyldren of Israel walked vpon drye lande thorowe the myddest of the see, and the waters were a walle vnto them on the ryght hande of them, and on the left.
Exod.14.30	Thus the Lorde delyuered Israel the selfe same daye out of the hande of the Egipcians: and Israel sawe the Egipcians deed vpon the see syde.
Exod.14.31	And Israel sawe that mightye power which the Lord shewed vpon the Egipcians: and the people feared the Lorde, and beleued the Lorde and his seruaunt Moses.
Exod.15.1	Then Moses Ꟶ the chyldren of Israel sange this songe vnto the Lord and sayde: I wyll syng vnto the Lorde: for he hath triumphed gloriously: the horse and him that rode vpon him hath he ouerthrowne in the see.
Exod.15.2	The Lord is my strength and prayse, and he is become my saluacion. He is my God, and I wyll glorify hym: my fathers God, Ꟶ I wyll exalte hym.
Exod.15.3	The Lorde is a man of warre. The Lorde is hys name.
Exod.15.4	Pharaos charettes and his hoost hath he caste into the see. Hys chosen captaynes also are drowned in the red see,
Exod.15.5	the depe waters haue couered them: they soncke to the botome as a stone.
Exod.15.6	Thy ryght hande Lorde, is become glorious in power: thy ryght hande Lorde hath all to dashed the enemy.
Exod.15.7	And in thy greate glory thou hast ouerthrowne them that rose vp agaynst the: thou sentest forth thy wrath which consumed them euen as stobell.
Exod.15.8	Thorowe the winde of thy nastrels the water gathered together, the floudes stode styll as an heape, and the depe water congeled together in the hert of the see.
Exod.15.9	The enemye sayd: I wyll folowe on them: I will ouertake them, I will deuyde the spoyle, I wyll satisfye my lust vpon them, I wyll drawe my sweard, myne hande shall destroye them.
Exod.15.10	Thou blewdest wt thy wynde, the see couered them, they sancke as leed in the mightye waters.
Exod.15.11	Who is lyke vnto the, o Lorde, among goddes? who is lyke the so glorious in holynes, fearfull in prayses, shewing wonders?
Exod.15.12	Thou stretchedest out thy ryght hande, the erth swalowed them.
Exod.15.13	Thou in thy mercye hast caryed thys people which thou deliueredst: Ꟶ hast brought them in thy strength vnto thy holy habitatyon.
Exod.15.14	The nations heard and were afrayed, sorowe came vpon the Philistines.
Exod.15.15	Then the dukes of the Edomites were amased, and the mightyest of the Moabites, tremblynge came vpon them: all the inhabiters of Canaan waxed faynte harted:
Exod.15.16	Lett feare and dreade fall vpon them in the greatnes of thyne arme, let them be as styll as a stone, tyll thy people passe thorowe, O Lorde, whyle thys people passe thorowe, which thou hast goten.
Exod.15.17	Thou shalte brynge them in, and plante them in the mountayne of thyne enheritaunce, the place, Lord, which thou hast made for to dwell in, the sanctuary, o Lorde, which thy handes haue prepared.
Exod.15.18	The Lorde shall raigne euer and all waye.
Exod.15.19	For Pharaos horse went in wt his charettes and horsemen into the see, Ꟶ the Lord brought the waters of the see vpon them. But the children of Israel went on drye land in the myddest of the see.
Exod.15.20	And Mir Iam a prophetysse the syster of Aaron toke a tymbrell in her hande, Ꟶ all the wemen came out after her wt tymbrels Ꟶ daunces.
Exod.15.21	And Mir Iam sange before them: Synge ye vnto the Lorde: for he hath triumphed gloriously: the horse Ꟶ his ryder hath he ouerthrowne in the see.
Exod.15.22	And so Moses brought Israel from the redd see, Ꟶ they went out into the wildernes of Sur. And they went thre dayes longe in the wildernes, and founde no waters.
Exod.15.23	And whan they came to Mara, they coulde not drincke of the waters of Mara: for they were bytter: therfore the name of the place was called, Mara,
Exod.15.24	And the people murmured agaynst Moses, sayinge: what shall we drincke?
Exod.15.25	And he cried vnto the Lorde: and the Lorde shewed hym a tree, which when he had cast into the water, the waters were made swete. There he made them an ordinaunce and a lawe, and there he proued him,
Exod.15.26	Ꟶ sayde: If thou wylt herken vnto the voyce of the Lorde thy God, and wylt do that which is right in his sight, and wylt geue eare vnto his commaundementes, Ꟶ kepe all hys ordinaunces: then wyll I put none of these diseases vpon the which I brought vpon the Egipcians: for I am the Lorde that healeth the.
Exod.16.1	The children of Israel came to Elim where were xii. welles of water and .lxx. palme trees, and they abode there by the waters.
Exod.16.2	And they toke their iorney from Elim: Ꟶ all the hole company of the children of Israel came to the wildernes of Sin, which is betwene Elim and Synai: the .xv. day of the .ij. moneth after their departyng out of the lande of Egypt.
Exod.16.3	And the hole multitude of the children of Israel murmured agaynst Moses and Aaron in the wyldernes:
Exod.16.4	and the children of Israel sayde vnto them: wolde to God we had died by the hande of the Lorde in the lande of Egypte, when we sat by the fleshepottes, and when we dyd eate bread our belyes full: for ye haue brought vs out into this wyldernes, to kyll thys hole multitude with honger.
Exod.16.5	Then sayde the Lorde vnto Moses: behold, I wyll rayne bread from heauen to you, and the people shall go out, and gather daye by daye that I may proue them, whither they will walke in my lawe or no.
Exod.16.6	The .vj. daye they shal prepare for them selues that which they wyll bryng in, and let it be twise asmoch as they gather in dayly.
Exod.16.7	And Moses Ꟶ Aaron sayde vnto all the children of Israel: at euen ye shall knowe that it is the Lorde, which brought you out of the lande of Egypt:
Exod.16.8	and in the morning, ye shall se the glory of the Lorde: because he hath heard your grudginges agaynst the Lorde. And what are we that ye haue murmured against vs?
Exod.16.9	And Moses sayde: At euen shall the Lorde geue you flesh to eate, and in the mornyng bread ynough: for the Lorde hath hearde your murmurynges which ye murmur agaynst him: for what are we? your murmuringes are not against vs, but agaynst the Lorde.
Exod.16.10	And Moses spake vnto Aaron: Saye vnto all the company of the children of Israel, come forth before the Lorde: for he hath heard your grudgynges.
Exod.16.11	And as Aaron spake vnto the hole multytude of the chyldren of Israel, they loked towarde the wildernes: and beholde, the glorye of the Lorde appeared in the cloude.
Exod.16.12	And the Lord spake vnto Moses, saying:
Exod.16.13	I haue hearde the murmurynge of the chyldren of Israel, tell them therfore and saye: at euen ye shall eate flesh, and in the morning ye shalbe fylled with breed, and ye shall knowe that I am the Lord your God.
Exod.16.14	And at euen the quayles came and couered the grounde where they laye. And in the morninge, the dewe laye rounde about the hooste.
Exod.16.15	And when the dewe was fallen: beholde it laye vpon the grounde in the wyldernes, small Ꟶ round and thyn as the hore frost on the grounde.
Exod.16.16	And when the chyldren of Israel sawe it, they sayde euery one to hys neyghboure: It is Manna. For they wist not what it was. And Moses sayde vnto them: this is the breed which the Lord hath geuen you to eate.
Exod.16.17	This is the worde which the Lorde hath commaunded: gather of it euery man for him self to eate: a gomer full for a man according to the nombre of you, and take euery man for them which are in his tente.
Exod.16.18	And the chyldren of Israel dyd euen so, Ꟶ gathered some more, some lesse,
Exod.16.19	and when they dyd mete it with a gomer, vnto hym that had gathered moch, remayned nothing ouer, and vnto him that had gathered litle, was there no lacke: euery man gathered sufficient for his eatyng.
Exod.16.20	And Moses sayde vnto them: Se that no man let ought remayne of it tyll the mornyng.
Exod.16.21	Not withstondyng they harkened not vnto Moses: but some of them lefte of it vntyll the mornyng, and it waxed full of wormes and stancke, and Moses was angry with them.
Exod.16.22	And they gathered it all morninges, euery man for hys eatynge. And assoone as the heate of the sunne came, it moulte.
Exod.16.23	And the sixte day, they gathered twise so moch breed two gomers for one man: Ꟶ all the rulers of the multitude came, Ꟶ tolde Moses.
Exod.16.24	He sayd vnto them: this is that which the Lorde hath sayde: tomorow is the rest of the holy Sabbath vnto the Lord: bake that which ye will bake, and seth that ye will seth, and that which remayneth, laye vp tyll the mornynge.
Exod.16.25	And they layde it vp tyll the mornynge, as Moses bad: and it stanke not, nether breed there any worme therin.
Exod.16.26	And Moses sayde: that eate thys daye: for it is the Sabbath vnto the Lorde: todaye ye shall not fynde it in the felde.
Exod.16.27	Syxe dayes ye shall gather it, and in the seuenth daye which is the Sabbath, there shalbe none.
Exod.16.28	Notwithstondyng, there went out some of the people in the seuenth daye for to gather, Ꟶ they founde none.
Exod.16.29	And the Lord sayde vnto Moses: howe longe refuse ye to kepe my commaundmentes and my lawes?
Exod.16.30	Se, the Lorde hath geuen you a Sabbath, therfore he geueth you the syxte daye bread for two dayes. Byde therfore euery man at home Ꟶ lett no man go out of hys place the seuenth daye.
Exod.16.31	And the people rested the seuenth daye.
Exod.16.32	And the house of Israel called it Manna. And it was lyke vnto coriander seede, whyte: and the taste of it was like vnto wafers made with hony.
Exod.16.33	And Moses sayd: this is that which the Lorde commaundeth, fyll a gomer of it, which maye be kept for youre children after you: that they maye se the bread wherwith I haue fedd you in wyldernesse, when I brought you out of the lande of Egipt.
Exod.16.34	And Moses spake vnto Aaron: take a cruse and put a gomer full of Manna therin, and laye it vp before the Lorde to be kepte for yor children after you,
Exod.16.35	as the Lorde commaunded Moses. So Aaron layde it vp before the testimonye to be kept.
Exod.16.36	And the chyldren of Israel dyd eate Manna fourtye yeare, vntyll they came vnto a lande inhabited. And so they dyd eate Manna euen vntyll they came vnto the borders of the land of Canaan.Exo
Exod.17.1	And all the company of the chyldren of Israel thorowout their armies went from the wyldernes of Sin after the commaundement of the Lorde, and pytched in Raphidim: where was no water for the people to drincke.
Exod.17.2	And the people chode with Moses, and sayde: geue vs water to drincke. Moses sayde vnto them: why chyde ye with me? wherfore do ye tempte the Lorde?
Exod.17.3	There the people thirsted for water, and the people murmured agaynst Moses, Ꟶ sayde: wherfore hast thou thus brought vs oute of Egipte: to kyll vs and oure chyldren and catell with thyrste?
Exod.17.4	And Moses cryed vnto the Lorde, saying: what shall I do vnto thys people? they be allmoost ready to stone me.
Exod.17.5	And the Lorde sayde vnto Moses: go before the people, and take wt the of the elders of Israel, Ꟶ thy rod wherwith thou smotest the ryuer, take in thyne hande, and go.
Exod.17.6	Beholde, I stonde before the besyde a rocke that is in Horeb: Ꟶ thou shalt smyte the rocke, and there shall come water out therof, that the people maye dryncke. And Moses dyd euen so before the eyes of the elders of Israel.
Exod.17.7	And he called the name of the place Masse and Meriba. because of the chidynge of the children of Israel, and because they tempted the Lorde, sayinge: is the Lorde amonge vs or not?
Exod.17.8	Then came Amalech and fought with Israel in Raphidim.
Exod.17.9	And Moses sayde vnto Iosua: chose vs oute men, and goo fyghte with Amalech. And tomorow I will stonde on the toppe of the hyll, and the rodd of God shalbe in my hande.
Exod.17.10	Iosua did as Moses bade hym, Ꟶ foughte with Amalech. And Moses, and Aaron, Ꟶ Hur went vp to the toppe of the hyll.
Exod.17.11	And it happened, that when Moses helde vp his hande, Israel had the better. And when he late hys hande downe, Amalech had the better.
Exod.17.12	But Moses handes were heuye, and therfore they toke a stone and put it vnder hym, and he satt downe there on. And Aaron and Hur stayed vp his handes, the one on the one syde and the other on the other syde. And hys handes remayned stedye vntyll the goynge downe of the sonne.
Exod.17.13	And Iosua discomfeted Amalech and hys people, with the edge of the swerde.
Exod.17.14	And the Lorde sayde vnto Moses: writte thys for a remembraunce in a boke, and commite it vnto the eares of Iosua, for I will vtterly put out the remembraunce of Amalech from vnder heauen.
Exod.17.15	And Moses made an alter and called the name of it. The Lorde is he that worketh myracles for me.
Exod.17.16	For he sayde: the hande is on the seate of God the Lorde wyll haue warre with Amalech from generacyon to generacyon.
Exod.18.1	Iethro the prest of Midiam Moses father in lawe herde of all that God had done for Moses and for Israel hys people, and that the Lord had broughte Israel out of Egypte.
Exod.18.2	Therfore he toke ziphora Moses wyfe, (After he had sente her backe)
Exod.18.3	and hyr two sonnes, of which the one was called Gerson, for he sayd: I haue bene an alient in a straunge lande.
Exod.18.4	The name of the other was Eliesar: for the God of my father (sayde he) was myne helpe, and delyuered me from the swerde of Pharao:
Exod.18.5	And Iethro Moses Father in lawe came with his two sonnes Ꟶ his wyfe vnto Moses into the wildernesse: where he abode by the mount of God.
Exod.18.6	And he sayde vnto Moses: I thy father in lawe Iethro am come to the, and thy wyfe also and hyr two sonnes with her.
Exod.18.7	And Moses went oute to mete hys father in lawe and dyd obeyssaunce and kyssed hym and eache asked other of hys health, and they came into the tent.
Exod.18.8	And Moses tolde hys father in lawe all that the Lorde had done vnto Pharao and to the Egyptians for Israels sake, and all the trauayle that had happened them by the waye, and howe the Lorde delyuered them.
Exod.18.9	And Iethro reioysed ouer all the goodnesse whyche the Lorde had done to Israell, and because he had delyuered them out of the hande of the Egyptians.
Exod.18.10	And Iethro sayde: blessed be the Lorde whiche hath delyuered you oute of the hande of the Egyptians and out of the hande of Pharao, which hath also delyuered hys people from the captyuite of the Egyptians.
Exod.18.11	Nowe I knowe that the Lorde is greater then all goddes, for in the thynge wherby they dealt cruelly wyth them, are they them selues peryshed.
Exod.18.12	And Iethro Moses father in lawe offred burntofferynges and sacrifyces vnto God. And Aaron and all the elders of Israel came to eate breade wyth Moses father in lawe before God.
Exod.18.13	And it chaunced on the morow, that Moses satt to iudge the people, and the people stode aboute Moses from mornynge vnto euen.
Exod.18.14	And whan Moses father in lawe sawe all that he did vnto the people, he sayd: what is thys that thou doest vnto the people? why syttest thou thy selfe alone, and all the people stonde aboute the from mornynge vnto euen?
Exod.18.15	And Moses sayde vnto hys father in lawe: because the people come vnto me to seke councell of God.
Exod.18.16	When they haue a matter, they come vnto me, and I iudge betwene euery man and hys neyghboure, and shewe them the ordynaunces of God and hys lawes.
Exod.18.17	And Moses father in lawe sayd vnto him: it is not well that thou doest.
Exod.18.18	Thou both weryest thy selfe, and thys people that is wt the: for thys thynge is of more weyght, then thou art able to perfourme thy selfe alone.
Exod.18.19	Heare nowe therfore my voyce, and I wyll geue the councell, and God shalbe with the. Be thou vnto the people to God warde, that thou mayest brynge the causes vnto God,
Exod.18.20	and thou shalt teache them ordinaunces and lawes, and shewe them the waye wherin they must walke, and the worke that they must doo.
Exod.18.21	Morouer thou shalt seke oute amonge all the people, men of actiuite, and such as feare God: true men, hatynge coueteousnes: and make them heedes ouer the people, captaynes ouer thousandes, ouer hundredes, ouer fyftye and ouer ten.
Exod.18.22	And let them iudge the people at all seasons. And euery greate matter that happeneth, let them bringe vnto the, but let them iudge all small causes them selues, and so shall it be easyer for thy selfe, and they shall bere with the.
Exod.18.23	If thou shalt do thys thinge, (and God charge the with all) thou shalt be able to endure, and yet the people shall come to theyr place in peace.
Exod.18.24	And so Moses obeyed the voyce of hys father in lawe, and did all that he had sayde,
Exod.18.25	and chose actyue men oute of all Israel and made them as heedes ouer the people: namely, captaynes ouer thousandes, ouer hundredes, ouerfyfty and ouerten.
Exod.18.26	And they iudged the people at all seasons, but broughte the harde causes vnto Moses: and iudged all small matters them selues.
Exod.18.27	And Moses let hys father in lawe departe, and he went into hys awne lande.
Exod.19.1	In the thyrde moneth, whan the children of Israel were gone oute of the lande of Egipt, the same daye came they into the wyldernesse of Sinay.
