Hos.0.0	¶ The booke of the Prophete Oseas.
Hos.12.8	Ephraim thinketh thus: Tush, I am rich. I haue good ynough: In all my worckes shall not one fawte be founde that I haue offended.
Hos.12.9	Yet am I the Lord thy God, euen as when I brought the out of the lande of Egypte, and sett the in thy tentes, and as in the hye feaste dayes.
Hos.12.10	I haue spoken thorowe the prophetes, Ꟶ shewed diuerse visyons and declared my selfe by the ministracion of the prophetes.
Hos.12.11	But at Gilaad is the abhominacyon, they are fallen to vanyte. At Gilgal they haue slayne oxen: as many heapes of stones as they had in theyr lande forowes, so many aulters haue they made.
Hos.12.12	Iacob fled in to the lande of Siria, Ꟶ Israell serued for a wife, Ꟶ for a wife he kepte shepe.
Hos.12.13	By a prophete the Lorde brought them out of Egypt, and by a prophet he preserued them.
Hos.12.14	But Ephraim hath puoked him to displeasure thorowe his abhominacyons, therfore shall his bloude be poured vpon him selfe, and the Lorde hys God shall rewarde hym hys blasphemyes.
Hos.13.1	When Ephraim spake, the hethen trembled: and he was exalted amonge the Israelytes, but he is gone backe to Baal, therfore must he dye.
Hos.13.2	And nowe they synne more and more: of their syluer, they make them molten ymages, after the ymaginacyons of ther awne braynes that is, very ydols, and yet all is nothinge but the worke of the craftesman: Not witstandynge they preache of the same to such as there sacrificeth: who so will kysse the calues, offreth perfectlye.
Hos.13.3	Therfore, they shalbe as the morninge cloude, and as the dewe that early passeth awaye and lyke as dust that the whorle wynde taketh awaye, from the flore, and as smoke that goeth out of the chymney.
Hos.13.4	I am the Lorde God, which brought the out of the lande of Egypt: that thou shuldest knowe no God but me onely, and that thou shuldest haue no Sauioure but only me.
Hos.13.5	I toke diligent hede of the in the wyldernesse the drye lande.
Hos.13.6	But when they were well fedde and had ynough, they waxed proude, Ꟶ forgat me
Hos.13.7	therfore will I be vnto them as a lyon and as a leoparde in the waye to the Assyrians.
Hos.13.8	I will come vpon them as she beare, that is robbed of her whelpes, Ꟶ I will breake that stubburne herte of theirs. There will I deuoure them as a lyon: yee: that wylde beastes shall teare them.
Hos.13.9	O Israel, thine iniquite hath destroyed the but in me only is thy helpe.
Hos.13.10	Where are thy kynges nowe, that shulde helpe the in all thy cyties? Yee, and thy iudges, of whom thou saydest: geue me a kyng and princes?
Hos.13.11	well, I gaue the a kynge in my wrath, and in my displeasure will I take hym from the agayne.
Hos.13.12	The wyckednesse of Ephraim is bounde together, and hys synne lyeth hyd.
Hos.13.13	Therfore, shall sorowes come vpon hym, as vpon a woman that trauayleth. An vndiscrete sonne is he, for he consydreth not, that he shulde not haue bene able to haue endured in the tyme of hys byrth,
Hos.13.14	had not I defended hym from the graue, and delyuered hym from death. O death, I will be thy death: O hell, I wyll be thy kynge.
Hos.13.15	Yet can I se no comforte, for when he is nowe the goodlyest amonge the brethren, the east wynde (euen the wynde of the Lorde) shall come downe from the wildernes, and drye vp his conduytes, Ꟶ dryncke vp his welles: he shall spoyle the treasure of all pleasaunt vessels.
Hos.13.16	As for Samaria, they shalbe made waste, and why? they are dysobedient vnto theyr God. They shall peryshe with the swearde, theyr chyldren shalbe slayne, and their wemen great with chylde shalbe rypte vp:
Hos.14.1	O Israell, turne the nowe, vnto the Lorde thy God, for thou hast taken a greate fall thorowe thy wickednes.
Hos.14.2	Take these wordes with you, when ye turne to the Lorde, and saye vnto hym: O, forgeue vs all oure synnes, receaue vs graciously, Ꟶ then wyll we offre the bullockes of oure lyppes vnto the:
Hos.14.3	Assur shalbe nomore oure helper, nether will we ryde vpon horses eny more. As for the worckes of oure handes, we wyll nomore call vpon them: For it is thou that art oure God, thou shewest euer mercye vnto the fatherlesse.
Hos.14.4	O (yf they wolde do this) I shulde heale theyr sores: yee, with all my herte wolde I loue them: so that my wrath shulde cleane be turned awaye from them.
Hos.14.5	Yee, I wolde be vnto Israel as the dewe, and he shulde growe as the lylie, and hys rote shulde breake out as Libanus.
Hos.14.6	His braunches shulde sprede out abroade and be as fayre as the olyue tre and smell as Libanus.
Hos.14.7	They that dwell vnder hys shadowe, shulde come agayne, and growe vp as the corne, Ꟶ floryshe as the vyne he shulde haue as good a name, as the wyne of Libanus.
Hos.14.8	O Ephraim, what haue I to do wyth Idols eny more? I wyll graciously heare hym, and sede hym forth. I wyll be vnto the as a grene fyrre tre, vpon me shalt thou fynde thy frute.
Hos.14.9	Who so is wise, shall vnderstand thys: and he that is ryght enstructe, wyll regarde it. For the wayes of the Lorde are ryghteous, soch as be Godly wyll walke in them. As for the wycked, they wyll stomble therin.
Hos.0.0	¶ The ende of the prophecye of Oseas.
